{
  "schema_version": "stage-bundle.v1",
  "bundle_id": "fixture-architect-valid-001",
  "stage": "architect",
  "produced_by": { "repository": "rezahh107/EV4-Architect-Repo", "ref": "fixture" },
  "evidence_status": "complete",
  "payload": {
    "project": { "id": "ev4-demo-project", "name": "EV4 Demo Project" },
    "handoff": { "summary": "Architect-approved handoff.", "requirements": ["Preserve approved design intent."], "constraints": ["Do not infer Builder runtime details."] }
  },
  "evidence": [{ "id": "architecture_handoff", "kind": "document", "state": "validated", "sha256": "aaaaaaaaaaaaaaaaaaaaaaaaaaaaaaaaaaaaaaaaaaaaaaaaaaaaaaaaaaaaaaaa", "description": "Synthetic architecture handoff fixture." }],
  "provenance": { "source": "synthetic-fixture", "created_by": "ev4-project-gate", "created_at": "2026-07-02T00:00:00Z" }
}
