{
  "schema_version": "stage-bundle.v1",
  "bundle_id": "fixture-builder-valid-001",
  "stage": "builder",
  "produced_by": { "repository": "rezahh107/EV4-Builder-Assistant-Repo", "ref": "fixture" },
  "evidence_status": "complete",
  "payload": { "project": { "id": "ev4-demo-project", "name": "EV4 Demo Project" }, "handoff": { "summary": "Builder output ready for responsive review." } },
  "evidence": [
    { "id": "builder_output", "kind": "document", "state": "validated", "sha256": "dddddddddddddddddddddddddddddddddddddddddddddddddddddddddddddddd", "description": "Synthetic Builder output fixture." },
    { "id": "build_evidence", "kind": "screenshot", "state": "validated", "sha256": "eeeeeeeeeeeeeeeeeeeeeeeeeeeeeeeeeeeeeeeeeeeeeeeeeeeeeeeeeeeeeeee", "description": "Synthetic build evidence fixture." }
  ],
  "provenance": { "source": "synthetic-fixture", "created_by": "ev4-project-gate", "created_at": "2026-07-02T00:00:00Z" }
}
